No.     Time           Source                Destination           Protocol Length Info                                                            New Column
      1 0.000000       192.168.0.2           74.125.200.105        TCP      54     59656 → https [ACK] Seq=1 Ack=1 Win=317 Len=0                 
      2 0.001320       74.125.200.105        192.168.0.2           TCP      60     [TCP ACKed unseen segment] https → 59656 [ACK] Seq=1 Ack=2 Win=245 Len=0 
      3 1.077253       192.168.0.2           192.168.0.1           DNS      84     Standard query 0xdcec PTR 2.0.168.192.in-addr.arpa              
      4 1.077294       192.168.0.2           192.168.0.1           DNS      87     Standard query 0x1f95 PTR 105.200.125.74.in-addr.arpa           
      5 1.111646       192.168.0.1           192.168.0.2           DNS      121    Standard query response 0x1f95 PTR 105.200.125.74.in-addr.arpa PTR sa-in-f105.1e100.net 
      6 2.076730       192.168.0.2           192.168.0.1           DNS      84     Standard query 0x0e89 PTR 1.0.168.192.in-addr.arpa              
      7 2.266751       192.168.0.2           192.168.0.1           DNS      81     Standard query 0x8766 A www.geeksforgeeks.org                   
      8 2.266807       192.168.0.2           192.168.0.1           DNS      81     Standard query 0x3003 A www.geeksforgeeks.org                   
      9 2.266828       192.168.0.2           35.161.25.33          TCP      74     45300 → http [SYN] Seq=0 Win=29200 Len=0 MSS=1460 SACK_PERM=1 TSval=1716173 TSecr=0 WS=128 
     10 2.272213       192.168.0.2           192.168.0.1           DNS      88     Standard query 0x2973 A degottd575b1t.cloudfront.net            
     11 2.272258       192.168.0.2           192.168.0.1           DNS      80     Standard query 0x0c3a A fonts.googleapis.com                    
     12 2.272289       192.168.0.2           192.168.0.1           DNS      80     Standard query 0x2967 AAAA fonts.googleapis.com                 
     13 2.272386       192.168.0.2           192.168.0.1           DNS      76     Standard query 0xe8f1 A cdn.fancybar.net                        
     14 2.272403       35.161.25.33          192.168.0.2           TCP      66     http → 45300 [SYN, ACK] Seq=0 Ack=1 Win=29200 Len=0 MSS=1360 SACK_PERM=1 WS=128 
     15 2.272408       192.168.0.2           192.168.0.1           DNS      76     Standard query 0xbbde AAAA cdn.fancybar.net                     
     16 2.272427       192.168.0.2           35.161.25.33          TCP      54     45300 → http [ACK] Seq=1 Ack=1 Win=29312 Len=0                
     17 2.272643       192.168.0.2           35.161.25.33          HTTP     771    GET / HTTP/1.1                                                  www.geeksforgeeks.org
     18 2.272653       192.168.0.2           192.168.0.1           DNS      85     Standard query 0x68de A www.googletagservices.com               
     19 2.272676       192.168.0.2           192.168.0.1           DNS      74     Standard query 0xf327 A cse.google.com                          
     20 2.272701       192.168.0.2           192.168.0.1           DNS      74     Standard query 0xd91f AAAA cse.google.com                       
     21 2.272758       192.168.0.2           192.168.0.1           DNS      85     Standard query 0x3ff8 AAAA www.googletagservices.com            
     22 2.275043       192.168.0.2           192.168.0.1           DNS      84     Standard query 0xfa9a A geeksforgeeks.disqus.com                
     23 2.275126       192.168.0.2           192.168.0.1           DNS      84     Standard query 0xadc3 AAAA geeksforgeeks.disqus.com             
     24 2.281777       35.161.25.33          192.168.0.2           TCP      54     http → 45300 [ACK] Seq=1 Ack=718 Win=30720 Len=0              
     25 2.368607       192.168.0.1           192.168.0.2           DNS      144    Standard query response 0x2967 AAAA fonts.googleapis.com CNAME googleadapis.l.google.com AAAA 2404:6800:4007:802::200a 
     26 2.373252       192.168.0.1           192.168.0.2           DNS      117    Standard query response 0xbbde AAAA cdn.fancybar.net CNAME fancybar.bsa.netdna-cdn.com 
     27 2.376283       192.168.0.1           192.168.0.2           DNS      132    Standard query response 0x0c3a A fonts.googleapis.com CNAME googleadapis.l.google.com A 216.58.197.42 
     28 2.377015       192.168.0.2           192.168.0.1           DNS      84     Standard query 0x69dc A www.google-analytics.com                
     29 2.377080       192.168.0.2           192.168.0.1           DNS      84     Standard query 0x61cd AAAA www.google-analytics.com             
     30 2.378819       192.168.0.1           192.168.0.2           DNS      141    Standard query response 0x68de A www.googletagservices.com CNAME pagead46.l.doubleclick.net A 172.217.26.162 
     31 2.388814       192.168.0.1           192.168.0.2           DNS      224    Standard query response 0x69dc A www.google-analytics.com CNAME www-google-analytics.l.google.com A 74.125.200.139 A 74.125.200.100 A 74.125.200.102 A 74.125.200.138 A 74.125.200.101 A 74.125.200.113 
     32 2.390544       192.168.0.1           192.168.0.2           DNS      133    Standard query response 0xe8f1 A cdn.fancybar.net CNAME fancybar.bsa.netdna-cdn.com A 23.111.10.144 
     33 2.391166       192.168.0.2           192.168.0.1           DNS      88     Standard query 0xa786 A partner.googleadservices.com            
     34 2.391250       192.168.0.2           192.168.0.1           DNS      88     Standard query 0x3db7 AAAA partner.googleadservices.com         
     35 2.391581       192.168.0.1           192.168.0.2           DNS      156    Standard query response 0x61cd AAAA www.google-analytics.com CNAME www-google-analytics.l.google.com AAAA 2404:6800:4007:805::200e 
     36 2.392378       192.168.0.2           192.168.0.1           DNS      74     Standard query 0xb585 A www.google.com                          
     37 2.392429       192.168.0.2           192.168.0.1           DNS      74     Standard query 0x6e29 AAAA www.google.com                       
     38 2.411984       192.168.0.1           192.168.0.2           DNS      129    Standard query response 0x3db7 AAAA partner.googleadservices.com CNAME partnerad.l.doubleclick.net 
     39 2.414378       192.168.0.1           192.168.0.2           DNS      170    Standard query response 0xb585 A www.google.com A 74.125.200.105 A 74.125.200.106 A 74.125.200.147 A 74.125.200.99 A 74.125.200.103 A 74.125.200.104 
     40 2.416024       192.168.0.1           192.168.0.2           DNS      102    Standard query response 0x6e29 AAAA www.google.com AAAA 2404:6800:4003:802::2004 
     41 2.416710       192.168.0.2           192.168.0.1           DNS      78     Standard query 0x5b3f A www.googleapis.com                      
     42 2.416766       192.168.0.2           192.168.0.1           DNS      78     Standard query 0x940e AAAA www.googleapis.com                   
     43 2.416907       192.168.0.1           192.168.0.2           DNS      145    Standard query response 0xa786 A partner.googleadservices.com CNAME partnerad.l.doubleclick.net A 172.217.26.194 
     44 2.417259       192.168.0.2           192.168.0.1           DNS      79     Standard query 0x6910 A clients1.google.com                     
     45 2.417297       192.168.0.2           192.168.0.1           DNS      79     Standard query 0x6944 AAAA clients1.google.com                  
     46 2.436958       192.168.0.1           192.168.0.2           DNS      140    Standard query response 0x940e AAAA www.googleapis.com CNAME googleapis.l.google.com AAAA 2404:6800:4007:807::200a 
     47 2.440174       192.168.0.1           192.168.0.2           DNS      208    Standard query response 0x5b3f A www.googleapis.com CNAME googleapis.l.google.com A 172.217.26.170 A 172.217.26.202 A 216.58.196.106 A 216.58.197.42 A 216.58.197.74 A 216.58.220.42 
     48 2.440190       192.168.0.1           192.168.0.2           DNS      119    Standard query response 0x6910 A clients1.google.com CNAME clients.l.google.com A 216.58.197.46 
     49 2.440646       192.168.0.2           192.168.0.1           DNS      89     Standard query 0x5c82 A pagead2.googlesyndication.com           
     50 2.440689       192.168.0.2           192.168.0.1           DNS      89     Standard query 0xc541 AAAA pagead2.googlesyndication.com        
     51 2.444624       192.168.0.1           192.168.0.2           DNS      131    Standard query response 0x6944 AAAA clients1.google.com CNAME clients.l.google.com AAAA 2404:6800:4007:802::200e 
     52 2.452408       192.168.0.1           192.168.0.2           DNS      145    Standard query response 0x5c82 A pagead2.googlesyndication.com CNAME pagead46.l.doubleclick.net A 172.217.26.162 
     53 2.453751       192.168.0.1           192.168.0.2           DNS      157    Standard query response 0xc541 AAAA pagead2.googlesyndication.com CNAME pagead46.l.doubleclick.net AAAA 2404:6800:4007:800::2002 
     54 2.714299       192.168.0.1           192.168.0.2           DNS      97     Standard query response 0x8766 A www.geeksforgeeks.org A 35.161.25.33 
     55 2.714707       192.168.0.2           192.168.0.1           DNS      81     Standard query 0x05e1 AAAA www.geeksforgeeks.org                
     56 2.818322       35.161.25.33          192.168.0.2           TCP      1414   [TCP segment of a reassembled PDU]                              
     57 2.818357       192.168.0.2           35.161.25.33          TCP      54     45300 → http [ACK] Seq=718 Ack=1361 Win=32128 Len=0           
     58 2.818738       35.161.25.33          192.168.0.2           TCP      1414   [TCP segment of a reassembled PDU]                              
     59 2.818755       192.168.0.2           35.161.25.33          TCP      54     45300 → http [ACK] Seq=718 Ack=2721 Win=35072 Len=0           
     60 2.819614       35.161.25.33          192.168.0.2           TCP      1414   [TCP segment of a reassembled PDU]                              
     61 2.819631       192.168.0.2           35.161.25.33          TCP      54     45300 → http [ACK] Seq=718 Ack=4081 Win=38016 Len=0           
     62 2.821191       35.161.25.33          192.168.0.2           TCP      1414   [TCP segment of a reassembled PDU]                              
     63 2.821207       192.168.0.2           35.161.25.33          TCP      54     45300 → http [ACK] Seq=718 Ack=5441 Win=40960 Len=0           
     64 2.821963       35.161.25.33          192.168.0.2           TCP      1414   [TCP segment of a reassembled PDU]                              
     65 2.821976       192.168.0.2           35.161.25.33          TCP      54     45300 → http [ACK] Seq=718 Ack=6801 Win=43904 Len=0           
     66 2.823864       35.161.25.33          192.168.0.2           TCP      1414   [TCP segment of a reassembled PDU]                              
     67 2.823878       192.168.0.2           35.161.25.33          TCP      54     45300 → http [ACK] Seq=718 Ack=8161 Win=46720 Len=0           
     68 2.825106       35.161.25.33          192.168.0.2           TCP      1414   [TCP segment of a reassembled PDU]                              
     69 2.825118       192.168.0.2           35.161.25.33          TCP      54     45300 → http [ACK] Seq=718 Ack=9521 Win=49664 Len=0           
     70 2.859121       192.168.0.2           216.58.220.2          TLSv1.2  698    Application Data                                                
     71 2.868333       192.168.0.2           192.168.0.1           DNS      78     Standard query 0xb79c A asia.adformdsp.net                      
     72 2.868396       192.168.0.2           192.168.0.1           DNS      78     Standard query 0x9fe1 AAAA asia.adformdsp.net                   
     73 2.868470       192.168.0.2           192.168.0.1           DNS      78     Standard query 0x0118 A asia.adformdsp.net                      
     74 2.868623       192.168.0.2           185.84.60.23          TCP      74     59874 → https [SYN] Seq=0 Win=29200 Len=0 MSS=1460 SACK_PERM=1 TSval=1716324 TSecr=0 WS=128 
     75 2.876992       185.84.60.23          192.168.0.2           TCP      66     https → 59874 [SYN, ACK] Seq=0 Ack=1 Win=29200 Len=0 MSS=1360 SACK_PERM=1 WS=128 
     76 2.877029       192.168.0.2           185.84.60.23          TCP      54     59874 → https [ACK] Seq=1 Ack=1 Win=29312 Len=0               
     77 2.877412       192.168.0.2           185.84.60.23          TLSv1.2  571    Client Hello                                                    
     78 2.881733       185.84.60.23          192.168.0.2           TCP      54     https → 59874 [ACK] Seq=1 Ack=518 Win=30336 Len=0             
     79 2.889249       192.168.0.1           192.168.0.2           DNS      152    Standard query response 0xb79c A asia.adformdsp.net CNAME track-apac.adformnet.akadns.net A 185.84.60.23 A 185.84.60.24 
     80 2.890781       192.168.0.1           192.168.0.2           DNS      120    Standard query response 0x9fe1 AAAA asia.adformdsp.net CNAME track-apac.adformnet.akadns.net 
     81 2.892215       192.168.0.1           192.168.0.2           DNS      152    Standard query response 0x0118 A asia.adformdsp.net CNAME track-apac.adformnet.akadns.net A 185.84.60.23 A 185.84.60.24 
     82 2.896761       216.58.220.2          192.168.0.2           TCP      60     https → 32820 [ACK] Seq=1 Ack=645 Win=297 Len=0               
     83 2.909308       192.168.0.2           52.222.136.65         TCP      74     44740 → http [SYN] Seq=0 Win=29200 Len=0 MSS=1460 SACK_PERM=1 TSval=1716334 TSecr=0 WS=128 
     84 2.909504       192.168.0.2           192.168.0.1           DNS      88     Standard query 0x6c5b A degottd575b1t.cloudfront.net            
     85 2.909842       192.168.0.2           216.58.197.42         TCP      74     60558 → http [SYN] Seq=0 Win=29200 Len=0 MSS=1460 SACK_PERM=1 TSval=1716334 TSecr=0 WS=128 
     86 2.910317       192.168.0.2           52.222.136.65         TCP      74     44744 → http [SYN] Seq=0 Win=29200 Len=0 MSS=1460 SACK_PERM=1 TSval=1716334 TSecr=0 WS=128 
     87 2.910754       192.168.0.2           52.222.136.65         TCP      74     44746 → http [SYN] Seq=0 Win=29200 Len=0 MSS=1460 SACK_PERM=1 TSval=1716334 TSecr=0 WS=128 
     88 2.911162       192.168.0.2           52.222.136.65         TCP      74     44748 → http [SYN] Seq=0 Win=29200 Len=0 MSS=1460 SACK_PERM=1 TSval=1716334 TSecr=0 WS=128 
     89 2.911658       192.168.0.2           172.217.26.162        TCP      74     51378 → http [SYN] Seq=0 Win=29200 Len=0 MSS=1460 SACK_PERM=1 TSval=1716334 TSecr=0 WS=128 
     90 2.914016       52.222.136.65         192.168.0.2           TCP      66     http → 44740 [SYN, ACK] Seq=0 Ack=1 Win=29200 Len=0 MSS=1360 SACK_PERM=1 WS=128 
     91 2.914043       192.168.0.2           52.222.136.65         TCP      54     44740 → http [ACK] Seq=1 Ack=1 Win=29312 Len=0                
     92 2.917624       216.58.220.2          192.168.0.2           TLSv1.2  209    Application Data, Application Data                              
     93 2.917643       192.168.0.2           216.58.220.2          TCP      54     32820 → https [ACK] Seq=645 Ack=156 Win=380 Len=0             
     94 2.917658       216.58.220.2          192.168.0.2           TLSv1.2  100    Application Data                                                
     95 2.917665       192.168.0.2           216.58.220.2          TCP      54     32820 → https [ACK] Seq=645 Ack=202 Win=380 Len=0             
     96 2.920817       216.58.197.42         192.168.0.2           TCP      66     http → 60558 [SYN, ACK] Seq=0 Ack=1 Win=29200 Len=0 MSS=1360 SACK_PERM=1 WS=128 
     97 2.920836       192.168.0.2           216.58.197.42         TCP      54     60558 → http [ACK] Seq=1 Ack=1 Win=29312 Len=0                
     98 2.923299       35.161.25.33          192.168.0.2           TCP      1414   [TCP segment of a reassembled PDU]                              
     99 2.923315       192.168.0.2           35.161.25.33          TCP      54     45300 → http [ACK] Seq=718 Ack=10881 Win=52608 Len=0          
    100 2.923329       35.161.25.33          192.168.0.2           TCP      1414   [TCP segment of a reassembled PDU]                              
    101 2.923337       192.168.0.2           35.161.25.33          TCP      54     45300 → http [ACK] Seq=718 Ack=12241 Win=55552 Len=0          
    102 2.923345       35.161.25.33          192.168.0.2           TCP      1414   [TCP segment of a reassembled PDU]                              
    103 2.923349       192.168.0.2           35.161.25.33          TCP      54     45300 → http [ACK] Seq=718 Ack=13601 Win=58496 Len=0          
    104 2.923355       35.161.25.33          192.168.0.2           HTTP     305    HTTP/1.1 200 OK  (text/html)                                    
    105 2.923360       192.168.0.2           35.161.25.33          TCP      54     45300 → http [ACK] Seq=718 Ack=13852 Win=61184 Len=0          
    106 2.923665       52.222.136.65         192.168.0.2           TCP      66     http → 44744 [SYN, ACK] Seq=0 Ack=1 Win=29200 Len=0 MSS=1360 SACK_PERM=1 WS=128 
    107 2.923681       192.168.0.2           52.222.136.65         TCP      54     44744 → http [ACK] Seq=1 Ack=1 Win=29312 Len=0                
    108 2.926713       52.222.136.65         192.168.0.2           TCP      66     http → 44746 [SYN, ACK] Seq=0 Ack=1 Win=29200 Len=0 MSS=1360 SACK_PERM=1 WS=128 
    109 2.926739       192.168.0.2           52.222.136.65         TCP      54     44746 → http [ACK] Seq=1 Ack=1 Win=29312 Len=0                
    110 2.929140       52.222.136.65         192.168.0.2           TCP      66     http → 44748 [SYN, ACK] Seq=0 Ack=1 Win=29200 Len=0 MSS=1360 SACK_PERM=1 WS=128 
    111 2.929162       192.168.0.2           52.222.136.65         TCP      54     44748 → http [ACK] Seq=1 Ack=1 Win=29312 Len=0                
    112 2.930512       172.217.26.162        192.168.0.2           TCP      66     http → 51378 [SYN, ACK] Seq=0 Ack=1 Win=29200 Len=0 MSS=1360 SACK_PERM=1 WS=128 
    113 2.930529       192.168.0.2           172.217.26.162        TCP      54     51378 → http [ACK] Seq=1 Ack=1 Win=29312 Len=0                
    114 2.932013       192.168.0.2           216.58.220.2          TLSv1.2  100    Application Data                                                
    115 2.932185       192.168.0.2           35.161.25.33          TCP      74     45316 → http [SYN] Seq=0 Win=29200 Len=0 MSS=1460 SACK_PERM=1 TSval=1716340 TSecr=0 WS=128 
    116 2.933648       216.58.220.2          192.168.0.2           TCP      60     https → 32820 [ACK] Seq=202 Ack=691 Win=297 Len=0             
    117 2.936250       35.161.25.33          192.168.0.2           TCP      66     http → 45316 [SYN, ACK] Seq=0 Ack=1 Win=29200 Len=0 MSS=1360 SACK_PERM=1 WS=128 
    118 2.936278       192.168.0.2           35.161.25.33          TCP      54     45316 → http [ACK] Seq=1 Ack=1 Win=29312 Len=0                
    119 3.076264       192.168.0.2           192.168.0.1           DNS      85     Standard query 0x0bb2 PTR 33.25.161.35.in-addr.arpa             
    120 3.094814       192.168.0.2           192.168.0.1           DNS      85     Standard query 0xa6e0 A www.googletagservices.com               
    121 3.100546       192.168.0.1           192.168.0.2           DNS      141    Standard query response 0xa6e0 A www.googletagservices.com CNAME pagead46.l.doubleclick.net A 172.217.26.162 
    122 3.100872       192.168.0.2           192.168.0.1           DNS      74     Standard query 0x5f0d A cse.google.com                          
    123 3.106653       192.168.0.1           192.168.0.2           DNS      90     Standard query response 0x5f0d A cse.google.com A 216.58.220.14 
    124 3.113244       192.168.0.2           23.111.10.144         TCP      74     44418 → http [SYN] Seq=0 Win=29200 Len=0 MSS=1460 SACK_PERM=1 TSval=1716385 TSecr=0 WS=128 
    125 3.113289       192.168.0.2           172.217.26.162        TCP      74     51384 → http [SYN] Seq=0 Win=29200 Len=0 MSS=1460 SACK_PERM=1 TSval=1716385 TSecr=0 WS=128 
    126 3.113319       192.168.0.2           216.58.220.14         TCP      74     59172 → http [SYN] Seq=0 Win=29200 Len=0 MSS=1460 SACK_PERM=1 TSval=1716385 TSecr=0 WS=128 
    127 3.113659       192.168.0.2           216.58.197.46         TCP      66     35368 → http [FIN, ACK] Seq=1 Ack=1 Win=237 Len=0 TSval=1716385 TSecr=785997792 
    128 3.118683       23.111.10.144         192.168.0.2           TCP      66     http → 44418 [SYN, ACK] Seq=0 Ack=1 Win=29200 Len=0 MSS=1360 SACK_PERM=1 WS=128 
    129 3.118710       192.168.0.2           23.111.10.144         TCP      54     44418 → http [ACK] Seq=1 Ack=1 Win=29312 Len=0                
    130 3.121180       172.217.26.162        192.168.0.2           TCP      66     http → 51384 [SYN, ACK] Seq=0 Ack=1 Win=29200 Len=0 MSS=1360 SACK_PERM=1 WS=128 
    131 3.121208       192.168.0.2           172.217.26.162        TCP      54     51384 → http [ACK] Seq=1 Ack=1 Win=29312 Len=0                
    132 3.122562       216.58.220.14         192.168.0.2           TCP      66     http → 59172 [SYN, ACK] Seq=0 Ack=1 Win=29200 Len=0 MSS=1360 SACK_PERM=1 WS=128 
    133 3.122589       192.168.0.2           216.58.220.14         TCP      54     59172 → http [ACK] Seq=1 Ack=1 Win=29312 Len=0                
    134 3.128481       185.84.60.23          192.168.0.2           TLSv1.2  230    Server Hello, Change Cipher Spec, Encrypted Handshake Message   
    135 3.128502       192.168.0.2           185.84.60.23          TCP      54     59874 → https [ACK] Seq=518 Ack=177 Win=30336 Len=0           
    136 3.143295       216.58.197.46         192.168.0.2           TCP      66     http → 35368 [FIN, ACK] Seq=1 Ack=2 Win=341 Len=0 TSval=786002412 TSecr=1716385 
    137 3.143322       192.168.0.2           216.58.197.46         TCP      66     35368 → http [ACK] Seq=2 Ack=2 Win=237 Len=0 TSval=1716392 TSecr=786002412 
    138 3.156752       192.168.0.2           185.84.60.23          TLSv1.2  129    Change Cipher Spec, Encrypted Handshake Message                 
    139 3.157057       192.168.0.2           192.168.0.1           DNS      84     Standard query 0xfee3 A geeksforgeeks.disqus.com                
    140 3.157287       192.168.0.2           185.84.60.23          TCP      1414   [TCP segment of a reassembled PDU]                              
    141 3.157396       192.168.0.2           216.58.220.14         HTTP     530    GET /cse.js?cx=009682134359037907028:tj6eafkv_be HTTP/1.1       cse.google.com
    142 3.158227       192.168.0.2           185.84.60.23          TLSv1.2  91     Application Data                                                
    143 3.161969       185.84.60.23          192.168.0.2           TCP      54     https → 59874 [ACK] Seq=177 Ack=593 Win=30336 Len=0           
    144 3.161989       185.84.60.23          192.168.0.2           TCP      54     https → 59874 [ACK] Seq=177 Ack=1953 Win=33280 Len=0          
    145 3.164506       216.58.220.14         192.168.0.2           TCP      54     http → 59172 [ACK] Seq=1 Ack=477 Win=30336 Len=0              
    146 3.164525       185.84.60.23          192.168.0.2           TCP      54     https → 59874 [ACK] Seq=177 Ack=1990 Win=33280 Len=0          
    147 3.168095       192.168.0.1           192.168.0.2           DNS      142    Standard query response 0xfee3 A geeksforgeeks.disqus.com CNAME prod.disqus.map.fastlylb.net A 151.101.40.134 
    148 3.174975       192.168.0.2           151.101.40.134        TCP      74     34592 → http [SYN] Seq=0 Win=29200 Len=0 MSS=1460 SACK_PERM=1 TSval=1716400 TSecr=0 WS=128 
    149 3.178686       151.101.40.134        192.168.0.2           TCP      66     http → 34592 [SYN, ACK] Seq=0 Ack=1 Win=29200 Len=0 MSS=1360 SACK_PERM=1 WS=128 
    150 3.178712       192.168.0.2           151.101.40.134        TCP      54     34592 → http [ACK] Seq=1 Ack=1 Win=29312 Len=0                
    151 3.185381       192.168.0.2           192.168.0.1           DNS      82     Standard query 0xa34b A auth.geeksforgeeks.org                  
    152 3.185416       192.168.0.2           192.168.0.1           DNS      82     Standard query 0x9c95 AAAA auth.geeksforgeeks.org               
    153 3.208274       192.168.0.2           172.217.26.194        TCP      74     45998 → http [SYN] Seq=0 Win=29200 Len=0 MSS=1460 SACK_PERM=1 TSval=1716409 TSecr=0 WS=128 
    154 3.211976       172.217.26.194        192.168.0.2           TCP      66     http → 45998 [SYN, ACK] Seq=0 Ack=1 Win=29200 Len=0 MSS=1360 SACK_PERM=1 WS=128 
    155 3.212015       192.168.0.2           172.217.26.194        TCP      54     45998 → http [ACK] Seq=1 Ack=1 Win=29312 Len=0                
    156 3.239779       192.168.0.2           52.34.13.184          TCP      74     36308 → http [SYN] Seq=0 Win=29200 Len=0 MSS=1460 SACK_PERM=1 TSval=1716416 TSecr=0 WS=128 
    157 3.239836       192.168.0.2           52.34.13.184          TCP      74     36310 → http [SYN] Seq=0 Win=29200 Len=0 MSS=1460 SACK_PERM=1 TSval=1716416 TSecr=0 WS=128 
    158 3.245693       52.34.13.184          192.168.0.2           TCP      66     http → 36308 [SYN, ACK] Seq=0 Ack=1 Win=29200 Len=0 MSS=1360 SACK_PERM=1 WS=128 
    159 3.245719       192.168.0.2           52.34.13.184          TCP      54     36308 → http [ACK] Seq=1 Ack=1 Win=29312 Len=0                
    160 3.245989       52.34.13.184          192.168.0.2           TCP      66     http → 36310 [SYN, ACK] Seq=0 Ack=1 Win=29200 Len=0 MSS=1360 SACK_PERM=1 WS=128 
    161 3.246005       192.168.0.2           52.34.13.184          TCP      54     36310 → http [ACK] Seq=1 Ack=1 Win=29312 Len=0                
    162 3.276057       192.168.0.2           52.34.13.184          HTTP     818    GET /profileLink.php HTTP/1.1                                   auth.geeksforgeeks.org
    163 3.279674       52.34.13.184          192.168.0.2           TCP      54     http → 36310 [ACK] Seq=1 Ack=765 Win=30848 Len=0              
    164 3.291617       185.84.60.23          192.168.0.2           TLSv1.2  523    Application Data                                                
    165 3.327985       192.168.0.2           185.84.60.23          TCP      54     59874 → https [ACK] Seq=1990 Ack=646 Win=31360 Len=0          
    166 3.368868       192.168.0.1           192.168.0.2           DNS      147    Standard query response 0x0bb2 PTR 33.25.161.35.in-addr.arpa PTR ec2-35-161-25-33.us-west-2.compute.amazonaws.com 
    167 3.405154       192.168.0.2           151.101.40.134        HTTP     1190   GET /count-data.js?1=139695%20http%3A%2F%2Fwww.geeksforgeeks.org%2F%3Fp%3D139695&1=139741%20http%3A%2F%2Fwww.geeksforgeeks.org%2F%3Fp%3D139741&1=139747%20http%3A%2F%2Fwww.geeksforgeeks.org%2F%3Fp%3D139747&1=139749%20http%3A%2F%2Fwww.geeksforgeeks.org%2F%3Fp%3D139749&1=139752%20http%3A%2F%2Fwww.geeksforgeeks.org%2F%3Fp%3D139752&1=139753%20http%3A%2F%2Fwww.geeksforgeeks.org%2F%3Fp%3D139753&1=139754%20http%3A%2F%2Fwww.geeksforgeeks.org%2F%3Fp%3D139754&1=139756%20http%3A%2F%2Fwww.geeksforgeeks.org%2F%3Fp%3D139756&1=139763%20http%3A%2F%2Fwww.geeksforgeeks.org%2F%3Fp%3D139763&1=139764%20http%3A%2F%2Fwww.geeksforgeeks.org%2F%3Fp%3D139764 HTTP/1.1  geeksforgeeks.disqus.com
    168 3.405387       192.168.0.2           151.101.40.134        TCP      74     34600 → http [SYN] Seq=0 Win=29200 Len=0 MSS=1460 SACK_PERM=1 TSval=1716458 TSecr=0 WS=128 
    169 3.409559       151.101.40.134        192.168.0.2           TCP      54     http → 34592 [ACK] Seq=1 Ack=1137 Win=32128 Len=0             
    170 3.412675       151.101.40.134        192.168.0.2           TCP      66     http → 34600 [SYN, ACK] Seq=0 Ack=1 Win=29200 Len=0 MSS=1360 SACK_PERM=1 WS=128 
    171 3.412702       192.168.0.2           151.101.40.134        TCP      54     34600 → http [ACK] Seq=1 Ack=1 Win=29312 Len=0                
    172 3.412898       192.168.0.2           151.101.40.134        HTTP     694    GET /count-data.js?1=139765%20http%3A%2F%2Fwww.geeksforgeeks.org%2F%3Fp%3D139765&1=139766%20http%3A%2F%2Fwww.geeksforgeeks.org%2F%3Fp%3D139766 HTTP/1.1  geeksforgeeks.disqus.com
    173 3.416191       151.101.40.134        192.168.0.2           TCP      54     http → 34600 [ACK] Seq=1 Ack=641 Win=30592 Len=0              
    174 3.464663       192.168.0.1           192.168.0.2           DNS      98     Standard query response 0xa34b A auth.geeksforgeeks.org A 52.34.13.184 
    175 3.513029       192.168.0.2           216.58.220.2          TLSv1.2  743    Application Data                                                
    176 3.553109       216.58.220.2          192.168.0.2           TCP      60     https → 32838 [ACK] Seq=1 Ack=690 Win=363 Len=0               
    177 3.635159       192.168.0.2           216.58.220.46         TLSv1.2  539    Application Data                                                
    178 3.659077       216.58.220.46         192.168.0.2           TLSv1.2  169    Application Data                                                
    179 3.659104       192.168.0.2           216.58.220.46         TCP      66     46374 → https [ACK] Seq=474 Ack=104 Win=1774 Len=0 TSval=1716521 TSecr=1057602119 
    180 3.659118       216.58.220.46         192.168.0.2           TLSv1.2  139    Application Data                                                
    181 3.659123       192.168.0.2           216.58.220.46         TCP      66     46374 → https [ACK] Seq=474 Ack=177 Win=1774 Len=0 TSval=1716521 TSecr=1057602119 
    182 3.659507       216.58.220.46         192.168.0.2           TLSv1.2  112    Application Data                                                
    183 3.659516       192.168.0.2           216.58.220.46         TCP      66     46374 → https [ACK] Seq=474 Ack=223 Win=1774 Len=0 TSval=1716521 TSecr=1057602119 
    184 3.659611       192.168.0.2           216.58.220.46         TLSv1.2  112    Application Data                                                
    185 3.666936       216.58.220.14         192.168.0.2           TCP      1414   [TCP segment of a reassembled PDU]                              
    186 3.666957       192.168.0.2           216.58.220.14         TCP      54     59172 → http [ACK] Seq=477 Ack=1361 Win=32128 Len=0           
    187 3.669614       216.58.220.14         192.168.0.2           HTTP     562    HTTP/1.1 200 OK  (text/javascript)                              
    188 3.669629       192.168.0.2           216.58.220.14         TCP      54     59172 → http [ACK] Seq=477 Ack=1869 Win=34944 Len=0           
    189 3.687802       192.168.0.2           216.58.220.2          TLSv1.2  755    Application Data                                                
    190 3.691323       216.58.220.2          192.168.0.2           TCP      60     https → 32838 [ACK] Seq=1 Ack=1391 Win=379 Len=0              
    191 3.697841       192.168.0.2           74.125.200.103        TCP      74     35894 → http [SYN] Seq=0 Win=29200 Len=0 MSS=1460 SACK_PERM=1 TSval=1716531 TSecr=0 WS=128 
    192 3.707461       74.125.200.103        192.168.0.2           TCP      66     http → 35894 [SYN, ACK] Seq=0 Ack=1 Win=29200 Len=0 MSS=1360 SACK_PERM=1 WS=128 
    193 3.707487       192.168.0.2           74.125.200.103        TCP      54     35894 → http [ACK] Seq=1 Ack=1 Win=29312 Len=0                
    194 3.722442       216.58.220.46         192.168.0.2           TCP      66     https → 46374 [ACK] Seq=223 Ack=520 Win=487 Len=0 TSval=1057602182 TSecr=1716521 
    195 3.734254       216.58.220.2          192.168.0.2           TLSv1.2  132    Application Data                                                
    196 3.734273       192.168.0.2           216.58.220.2          TCP      54     32838 → https [ACK] Seq=1391 Ack=79 Win=1332 Len=0            
    197 3.734618       216.58.220.2          192.168.0.2           TCP      1414   [TCP segment of a reassembled PDU]                              
    198 3.734625       192.168.0.2           216.58.220.2          TCP      54     32838 → https [ACK] Seq=1391 Ack=1439 Win=1354 Len=0          
    199 3.734637       216.58.220.2          192.168.0.2           TLSv1.2  1414   Application Data                                                
    200 3.734644       192.168.0.2           216.58.220.2          TCP      54     32838 → https [ACK] Seq=1391 Ack=2799 Win=1377 Len=0          
    201 3.734651       216.58.220.2          192.168.0.2           TLSv1.2  1414   Application Data                                                
    202 3.734656       192.168.0.2           216.58.220.2          TCP      54     32838 → https [ACK] Seq=1391 Ack=4159 Win=1400 Len=0          
    203 3.734661       216.58.220.2          192.168.0.2           TLSv1.2  264    Application Data                                                
    204 3.734666       192.168.0.2           216.58.220.2          TCP      54     32838 → https [ACK] Seq=1391 Ack=4369 Win=1421 Len=0          
    205 3.735232       216.58.220.2          192.168.0.2           TCP      1414   [TCP segment of a reassembled PDU]                              
    206 3.735241       192.168.0.2           216.58.220.2          TCP      54     32838 → https [ACK] Seq=1391 Ack=5729 Win=1444 Len=0          
    207 3.735249       216.58.220.2          192.168.0.2           TLSv1.2  124    Application Data                                                
    208 3.735253       192.168.0.2           216.58.220.2          TCP      54     32838 → https [ACK] Seq=1391 Ack=5799 Win=1444 Len=0          
    209 3.735259       216.58.220.2          192.168.0.2           TCP      1414   [TCP segment of a reassembled PDU]                              
    210 3.735263       192.168.0.2           216.58.220.2          TCP      54     32838 → https [ACK] Seq=1391 Ack=7159 Win=1467 Len=0          
    211 3.735268       216.58.220.2          192.168.0.2           TLSv1.2  1414   Application Data                                                
    212 3.735272       192.168.0.2           216.58.220.2          TCP      54     32838 → https [ACK] Seq=1391 Ack=8519 Win=1490 Len=0          
    213 3.735278       216.58.220.2          192.168.0.2           TLSv1.2  1414   Application Data                                                
    214 3.735282       192.168.0.2           216.58.220.2          TCP      54     32838 → https [ACK] Seq=1391 Ack=9879 Win=1513 Len=0          
    215 3.738123       216.58.220.2          192.168.0.2           TLSv1.2  1414   Application Data                                                
    216 3.738140       192.168.0.2           216.58.220.2          TCP      54     32838 → https [ACK] Seq=1391 Ack=11239 Win=1535 Len=0         
    217 3.738153       216.58.220.2          192.168.0.2           TLSv1.2  1414   Application Data                                                
    218 3.738157       192.168.0.2           216.58.220.2          TCP      54     32838 → https [ACK] Seq=1391 Ack=12599 Win=1558 Len=0         
    219 3.738161       216.58.220.2          192.168.0.2           TLSv1.2  1414   Application Data                                                
    220 3.738164       192.168.0.2           216.58.220.2          TCP      54     32838 → https [ACK] Seq=1391 Ack=13959 Win=1581 Len=0         
    221 3.738168       216.58.220.2          192.168.0.2           TLSv1.2  1414   Application Data                                                
    222 3.738170       192.168.0.2           216.58.220.2          TCP      54     32838 → https [ACK] Seq=1391 Ack=15319 Win=1604 Len=0         
    223 3.738174       216.58.220.2          192.168.0.2           TLSv1.2  931    Application Data                                                
    224 3.738176       192.168.0.2           216.58.220.2          TCP      54     32838 → https [ACK] Seq=1391 Ack=16196 Win=1625 Len=0         
    225 3.740866       216.58.220.2          192.168.0.2           TCP      1414   [TCP segment of a reassembled PDU]                              
    226 3.740885       192.168.0.2           216.58.220.2          TCP      54     32838 → https [ACK] Seq=1391 Ack=17556 Win=1648 Len=0         
    227 3.740906       216.58.220.2          192.168.0.2           TLSv1.2  1414   Application Data                                                
    228 3.740912       192.168.0.2           216.58.220.2          TCP      54     32838 → https [ACK] Seq=1391 Ack=18916 Win=1671 Len=0         
    229 3.740922       216.58.220.2          192.168.0.2           TLSv1.2  1414   Application Data                                                
    230 3.740927       192.168.0.2           216.58.220.2          TCP      54     32838 → https [ACK] Seq=1391 Ack=20276 Win=1693 Len=0         
    231 3.740934       216.58.220.2          192.168.0.2           TLSv1.2  1414   Application Data                                                
    232 3.740938       192.168.0.2           216.58.220.2          TCP      54     32838 → https [ACK] Seq=1391 Ack=21636 Win=1716 Len=0         
    233 3.740945       216.58.220.2          192.168.0.2           TLSv1.2  1414   Application Data                                                
    234 3.740949       192.168.0.2           216.58.220.2          TCP      54     32838 → https [ACK] Seq=1391 Ack=22996 Win=1739 Len=0         
    235 3.742696       216.58.220.2          192.168.0.2           TLSv1.2  1414   Application Data                                                
    236 3.742710       192.168.0.2           216.58.220.2          TCP      54     32838 → https [ACK] Seq=1391 Ack=24356 Win=1762 Len=0         
    237 3.742723       216.58.220.2          192.168.0.2           TLSv1.2  1414   Application Data                                                
    238 3.742728       192.168.0.2           216.58.220.2          TCP      54     32838 → https [ACK] Seq=1391 Ack=25716 Win=1785 Len=0         
    239 3.742735       216.58.220.2          192.168.0.2           TLSv1.2  1414   Application Data                                                
    240 3.742739       192.168.0.2           216.58.220.2          TCP      54     32838 → https [ACK] Seq=1391 Ack=27076 Win=1808 Len=0         
    241 3.742745       216.58.220.2          192.168.0.2           TLSv1.2  1316   Application Data                                                
    242 3.742750       192.168.0.2           216.58.220.2          TCP      54     32838 → https [ACK] Seq=1391 Ack=28338 Win=1830 Len=0         
    243 3.743641       192.168.0.2           216.58.220.2          TLSv1.2  100    Application Data                                                
    244 3.745186       216.58.220.2          192.168.0.2           TCP      60     https → 32838 [ACK] Seq=28338 Ack=1437 Win=379 Len=0          
    245 3.813127       192.168.0.2           216.58.220.2          TLSv1.2  766    Application Data                                                
    246 3.814748       216.58.220.2          192.168.0.2           TCP      60     https → 32838 [ACK] Seq=28338 Ack=2149 Win=396 Len=0          
    247 3.828970       192.168.0.2           74.125.200.103        TLSv1.2  852    Application Data                                                
    248 3.852118       192.168.0.2           74.125.200.103        HTTP     531    GET /cse/style/look/v2/default.css HTTP/1.1                     www.google.com
    249 3.854856       74.125.200.103        192.168.0.2           TCP      54     http → 35894 [ACK] Seq=1 Ack=478 Win=30336 Len=0              
    250 3.868745       74.125.200.103        192.168.0.2           TCP      60     https → 43824 [ACK] Seq=1 Ack=799 Win=341 Len=0               
